{
  "$schema": "https://json-schema.org/draft/2020-12/schema",
  "$id": "https://codicarium.local/v2.6/semver.v2.6",
  "title": "semver.v2.6",
  "type": "object",
  "required": [
    "verified_tags",
    "frozen_next_semver",
    "freeze_node",
    "refresh_required_before_mutation"
  ],
  "properties": {
    "verified_tags": {
      "type": "array",
      "minItems": 1,
      "items": {
        "type": "object"
      }
    },
    "frozen_next_semver": {
      "type": "string",
      "minLength": 1
    },
    "freeze_node": {
      "type": "string",
      "minLength": 1
    },
    "refresh_required_before_mutation": {
      "type": "boolean"
    }
  },
  "additionalProperties": false
}
