{
  "verified_tags": [
    {
      "tag": "v0.6.1",
      "verified": true,
      "source": "gh-api-read-only-2026-08-26T12:00:00Z",
      "commit": "915e276a48a6844ebf200988bf9596a00cd6af793ea9b3f7e69a9f8894e4cbe6"
    },
    {
      "tag": "v0.6.2",
      "verified": true,
      "source": "gh-api-read-only-2026-08-26T12:00:00Z",
      "commit": "21c3ab4fb27b6834ba163fc1ffe677063f7c316ae65844d64f428cb96006edf8"
    },
    {
      "tag": "v0.6.3",
      "verified": true,
      "source": "gh-api-read-only-2026-08-26T12:00:00Z",
      "commit": "93d508a56f0ecf144a4589f63fb328cbef8b0a840665410d1203284e4440114f"
    },
    {
      "tag": "v0.6.4",
      "verified": true,
      "source": "gh-api-read-only-2026-08-26T12:00:00Z",
      "commit": "becb946caae9c5cbf807ba3de60912b5e095b9dacaf50211e0fb3914df70146c"
    },
    {
      "tag": "v0.6.5",
      "verified": true,
      "source": "gh-api-read-only-2026-08-26T12:00:00Z",
      "commit": "3f09442321f85c03bd0e106e969c1ab6283719cf0c320d3c9bb8e2e4865e9e02"
    },
    {
      "tag": "v0.6.6",
      "verified": true,
      "source": "gh-api-read-only-2026-08-26T12:00:00Z",
      "commit": "03dba55048851b33da224d8e1c34d59944605e6f8ac50be946f6b337d8e0fa73"
    },
    {
      "tag": "v0.6.7",
      "verified": true,
      "source": "gh-api-read-only-2026-08-26T12:00:00Z",
      "commit": "8afcb147a8847762eecbf9c6bdfba3ea4bd709441a4500a30551fdf7af1c6d86"
    },
    {
      "tag": "v0.6.8",
      "verified": true,
      "source": "gh-api-read-only-2026-08-26T12:00:00Z",
      "commit": "b8fd4c904c970e80a271789e92df5bd4707716db55a37662647996e9c1d7374e"
    },
    {
      "tag": "v0.6.9",
      "verified": true,
      "source": "gh-api-read-only-2026-08-26T12:00:00Z",
      "commit": "1e327876bfa0676b0cf104b97da8676e892e36ee2d520544fee6e419489c7483"
    },
    {
      "tag": "v0.6.10",
      "verified": true,
      "source": "gh-api-read-only-2026-08-26T12:00:00Z",
      "commit": "020d4de60e8bccbc9ff618d631a8c380888d4b26b97614f110434855813d43a4"
    },
    {
      "tag": "v0.6.11",
      "verified": true,
      "source": "gh-api-read-only-2026-08-26T12:00:00Z",
      "commit": "0c82d284038ca86f33d2a814afeadf3f20e68a46869aaee9a748f296175b41f5"
    },
    {
      "tag": "v0.6.12",
      "verified": true,
      "source": "gh-api-read-only-2026-08-26T12:00:00Z",
      "commit": "80b07dcca19144631ce695268695d33f5dde7ef1e224099cef46c75e5560a62f"
    },
    {
      "tag": "v0.6.13",
      "verified": true,
      "source": "gh-api-read-only-2026-08-26T12:00:00Z",
      "commit": "32597c57731fc2a75b0d4b86ac77c530bbf772feff12f08059b762c5feb0a750"
    },
    {
      "tag": "v0.7.0",
      "verified": true,
      "source": "gh-api-read-only-2026-08-26T12:00:00Z",
      "commit": "50ab7418ec44018e5cfb2826c68fe26616f4ae4399ad5da286264e4e826b123b"
    },
    {
      "tag": "v0.7.1",
      "verified": true,
      "source": "gh-api-read-only-2026-08-26T12:00:00Z",
      "commit": "2724b4f1663e705871656c1f0626cdd0773f130aad5b2b13e54c5348a29a9f5e"
    },
    {
      "tag": "v0.7.2",
      "verified": true,
      "source": "gh-api-read-only-2026-08-26T12:00:00Z",
      "commit": "52d7469f54d1048815716640efdd8c1a707662ce4452d7be1097aa38dc7efd12"
    },
    {
      "tag": "v0.7.3",
      "verified": true,
      "source": "gh-api-read-only-2026-08-26T12:00:00Z",
      "commit": "01cd499b8951d3cf695ea685a4fe25c487c72ce40f7d15f32d3c5bd457299777"
    },
    {
      "tag": "v0.7.4",
      "verified": true,
      "source": "gh-api-read-only-2026-08-26T12:00:00Z",
      "commit": "c9651207b7ef66c5823dbab5ce5ea7306ff9cdadb34ed4241eb263ccff1c58a4"
    },
    {
      "tag": "v0.7.5",
      "verified": true,
      "source": "gh-api-read-only-2026-08-26T12:00:00Z",
      "commit": "0a73d951a4f9a178b79ff36a6fd89ee27532c60c2ccb1cd2d0217a20d6f6483d"
    },
    {
      "tag": "v0.7.6",
      "verified": true,
      "source": "gh-api-read-only-2026-08-26T12:00:00Z",
      "commit": "924414c8e36bf71df97dad1f3727201857f789fa15a18b1eb1c83d75014e07dd"
    }
  ],
  "frozen_next_semver": "v0.7.7",
  "freeze_node": "X39",
  "refresh_required_before_mutation": true
}
